{"$schema":"https://json-schema.org/draft/2020-12/schema","$id":"https://vexil-lang.org/release/schemas/checkpoint-change-unit-1.0.schema.json","type":"object","additionalProperties":false,"required":["$schema","$id","schemaVersion","recordKind","changeUnitId","baseCommit","checkpointCommit","paths","patchDigest","intent","behavior","evidence","owner","dependencies","disposition"],"properties":{"$schema":{"const":"https://json-schema.org/draft/2020-12/schema"},"$id":{"type":"string","pattern":"^https://vexil-lang.org/release/checkpoint-change-units/[a-z0-9][a-z0-9-]*[.]json$"},"schemaVersion":{"const":"1.0"},"recordKind":{"const":"checkpoint-change-unit"},"changeUnitId":{"type":"string","pattern":"^[a-z0-9][a-z0-9-]*$"},"baseCommit":{"type":"string","pattern":"^[0-9a-f]{40}$"},"checkpointCommit":{"type":"string","pattern":"^[0-9a-f]{40}$"},"paths":{"type":"array","minItems":1,"items":{"$ref":"#/$defs/pathChange"}},"patchDigest":{"type":"string","pattern":"^sha256:[0-9a-f]{64}$"},"intent":{"type":"string","minLength":1},"behavior":{"type":"string","minLength":1},"evidence":{"type":"array","minItems":1,"items":{"type":"string","minLength":1}},"owner":{"$ref":"#/$defs/owner"},"dependencies":{"type":"array","uniqueItems":true,"items":{"type":"string","pattern":"^[a-z0-9][a-z0-9-]*$"}},"disposition":{"enum":["proposed","approved","rejected","deferred"]}},"$defs":{"blob":{"type":"string","pattern":"^(?:[0-9a-f]{40}|0{40})$"},"pathChange":{"type":"object","additionalProperties":false,"required":["status","beforePath","afterPath","beforeBlob","afterBlob"],"properties":{"status":{"enum":["modified","renamed","deleted"]},"beforePath":{"type":"string","pattern":"^[A-Za-z0-9._/-]+$"},"afterPath":{"type":["string","null"],"pattern":"^[A-Za-z0-9._/-]+$"},"beforeBlob":{"$ref":"#/$defs/blob"},"afterBlob":{"$ref":"#/$defs/blob"}}},"owner":{"type":"object","additionalProperties":false,"required":["roleId","assignmentId"],"properties":{"roleId":{"enum":["repository-administrator","package-steward","documentation-maintainer"]},"assignmentId":{"type":"string","minLength":1}}}}}
