{"$id":"https://vexil-lang.org/release/checkpoint-change-units/checkpoint-documentation-copy-edits.json","$schema":"https://json-schema.org/draft/2020-12/schema","baseCommit":"11f315880415038ac6013d7ee4d378296cd51c5d","behavior":"No copy edit is approved by this proposed record.","changeUnitId":"checkpoint-documentation-copy-edits","checkpointCommit":"d4099e8188f40603ebf52473d6543ce4a6054201","dependencies":[],"disposition":"proposed","evidence":["checkpoint diff against recorded base","documentation review required"],"intent":"Isolate public prose edits from code, archive, and deletion changes.","owner":{"assignmentId":"assignment-repository-administrator-2026-07-14","roleId":"documentation-maintainer"},"patchDigest":"sha256:6aaf92a6e6006b61ab50bafd7c8f8ecaed06dcec7eff1ecf8656db128b782603","paths":[{"afterBlob":"e0f1c24713be88357051f452bf08ae82eba24303","afterPath":"CONTRIBUTING.md","beforeBlob":"31eaba72f7adde15c9e1e88f7cb264f73b3de06c","beforePath":"CONTRIBUTING.md","status":"modified"},{"afterBlob":"68f771312f6534f4e58b9513334ee28bd8633f06","afterPath":"FAQ.md","beforeBlob":"32cb5a84ca4c46dcbd6c9da681748412014ba808","beforePath":"FAQ.md","status":"modified"},{"afterBlob":"9228d7e83bfa5db9f3395e186f72b8c8292d62bf","afterPath":"README.md","beforeBlob":"316c1664564b2f9307bc59f85a573f206be9916e","beforePath":"README.md","status":"modified"},{"afterBlob":"25dc05096bf53a4094ca0e9096e94df7d3b6c0d3","afterPath":"docs/book/src/getting-started/first-schema.md","beforeBlob":"3ab8bfa69099c9c96c81b3e9e5c709de98408a50","beforePath":"docs/book/src/getting-started/first-schema.md","status":"modified"},{"afterBlob":"efce6e01823536b7f848c075eef348bde2e1468d","afterPath":"docs/book/src/introduction.md","beforeBlob":"78ea6213b603101155c5a7197513b2026c3d524d","beforePath":"docs/book/src/introduction.md","status":"modified"}],"recordKind":"checkpoint-change-unit","schemaVersion":"1.0"}
