{"$id":"https://vexil-lang.org/release/checkpoint-change-units/checkpoint-historical-plan-deletions.json","$schema":"https://json-schema.org/draft/2020-12/schema","baseCommit":"11f315880415038ac6013d7ee4d378296cd51c5d","behavior":"No deletion is approved or performed by this record.","changeUnitId":"checkpoint-historical-plan-deletions","checkpointCommit":"d4099e8188f40603ebf52473d6543ce4a6054201","dependencies":[],"disposition":"proposed","evidence":["deletion-only checkpoint slice","historical-plan retention decision required"],"intent":"Hold historical-plan deletions for independent disposition rather than folding them into archival or source changes.","owner":{"assignmentId":"assignment-repository-administrator-2026-07-14","roleId":"repository-administrator"},"patchDigest":"sha256:eb9f58654275fed3d556284f4a6ba2ab3f40cbf08b5c65a56f2146ef5c71f3b5","paths":[{"afterBlob":"0000000000000000000000000000000000000000","afterPath":null,"beforeBlob":"02022feea85c75a4f0b3e3c6828e540f49835038","beforePath":"docs/superpowers/plans/2026-03-25-milestone-b-frontend.md","status":"deleted"},{"afterBlob":"0000000000000000000000000000000000000000","afterPath":null,"beforeBlob":"11dcc5bf554c50d418102d68f6d83afc532236af","beforePath":"docs/superpowers/plans/2026-03-25-milestone-c-ir-typeck.md","status":"deleted"},{"afterBlob":"0000000000000000000000000000000000000000","afterPath":null,"beforeBlob":"4b8142dcd4f67c5a9c2db19069cae3fe08c7dae3","beforePath":"docs/superpowers/plans/2026-03-25-milestone-d-codegen.md","status":"deleted"},{"afterBlob":"0000000000000000000000000000000000000000","afterPath":null,"beforeBlob":"676e98d34b02bc1be991addd3d049839f0882e65","beforePath":"docs/superpowers/plans/2026-03-25-milestone-e-canonical-hash.md","status":"deleted"},{"afterBlob":"0000000000000000000000000000000000000000","afterPath":null,"beforeBlob":"3536c498e79b1cb06b960a4590c42eb62a93328d","beforePath":"docs/superpowers/plans/2026-03-25-milestone-f-import-resolution.md","status":"deleted"},{"afterBlob":"0000000000000000000000000000000000000000","afterPath":null,"beforeBlob":"535c9eafe663000432a61a43e4605513f92fd767","beforePath":"docs/superpowers/plans/2026-03-26-v010-sdk-release.md","status":"deleted"},{"afterBlob":"0000000000000000000000000000000000000000","afterPath":null,"beforeBlob":"74549c3fcdc53330c16ac3a27ccef204b35600dc","beforePath":"docs/superpowers/plans/2026-03-27-ts-backend-and-compliance.md","status":"deleted"},{"afterBlob":"0000000000000000000000000000000000000000","afterPath":null,"beforeBlob":"340da574323de247066c83cf7a0a690466800d73","beforePath":"docs/superpowers/plans/2026-03-30-language-gaps.md","status":"deleted"},{"afterBlob":"0000000000000000000000000000000000000000","afterPath":null,"beforeBlob":"07fcc3a2500186e4b39b8ac25c667263d8aa953c","beforePath":"docs/superpowers/plans/2026-04-09-phase2-review-1.md","status":"deleted"},{"afterBlob":"0000000000000000000000000000000000000000","afterPath":null,"beforeBlob":"a4f521231ac2355b94804b60813fedd385af8437","beforePath":"docs/superpowers/plans/2026-04-09-phase7-traits.md","status":"deleted"}],"recordKind":"checkpoint-change-unit","schemaVersion":"1.0"}
