{"$id":"https://vexil.dev/release/checkpoint-change-units/checkpoint-game-state-example-deletion.json","$schema":"https://json-schema.org/draft/2020-12/schema","baseCommit":"11f315880415038ac6013d7ee4d378296cd51c5d","behavior":"No deletion is approved or performed by this record.","changeUnitId":"checkpoint-game-state-example-deletion","checkpointCommit":"d4099e8188f40603ebf52473d6543ce4a6054201","dependencies":[],"disposition":"proposed","evidence":["single-path deletion checkpoint slice","example-owner review required"],"intent":"Hold the game-state example deletion for an independent compatibility and teaching-value disposition.","owner":{"assignmentId":"assignment-repository-administrator-2026-07-14","roleId":"repository-administrator"},"patchDigest":"sha256:2b741157e6eece52d2ca7dce033c33539dc7a67b658a658a7c97fac76e352031","paths":[{"afterBlob":"0000000000000000000000000000000000000000","afterPath":null,"beforeBlob":"817e4978a264856a4205977969efc8034114b284","beforePath":"examples/game-state/game.vexil","status":"deleted"}],"recordKind":"checkpoint-change-unit","schemaVersion":"1.0"}
