{"$id":"https://vexil-lang.org/release/checkpoint-change-units/checkpoint-plan-archival-moves.json","$schema":"https://json-schema.org/draft/2020-12/schema","baseCommit":"11f315880415038ac6013d7ee4d378296cd51c5d","behavior":"No archive move is approved or executed by this record.","changeUnitId":"checkpoint-plan-archival-moves","checkpointCommit":"d4099e8188f40603ebf52473d6543ce4a6054201","dependencies":[],"disposition":"proposed","evidence":["rename-only checkpoint slice","identical before and after blob identities"],"intent":"Separate archival moves from deletions and behavioral changes.","owner":{"assignmentId":"assignment-repository-administrator-2026-07-14","roleId":"repository-administrator"},"patchDigest":"sha256:b59896ec6f52c94ced8b8701da8113f0e59a5094fa4fcc90c6a97c4cc949e493","paths":[{"afterBlob":"6313ddc4d5ae782b121a79b7d646de3ae1208966","afterPath":"docs/plans/archive/01-trait-impl-implementation.md","beforeBlob":"6313ddc4d5ae782b121a79b7d646de3ae1208966","beforePath":"docs/plans/01-trait-impl-implementation.md","status":"renamed"},{"afterBlob":"e0da071155e364df1bda9407c9fae19d924ff593","afterPath":"docs/plans/archive/02-geometric-types-rust.md","beforeBlob":"e0da071155e364df1bda9407c9fae19d924ff593","beforePath":"docs/plans/02-geometric-types-rust.md","status":"renamed"},{"afterBlob":"eeffbf9615f37109f0f0ba47888c48281d4c5feb","afterPath":"docs/plans/archive/03-python-runtime.md","beforeBlob":"eeffbf9615f37109f0f0ba47888c48281d4c5feb","beforePath":"docs/plans/03-python-runtime.md","status":"renamed"},{"afterBlob":"469ee98719baa37a2c7a42bea9a1c3aebd0730f5","afterPath":"docs/plans/archive/04-go-runtime.md","beforeBlob":"469ee98719baa37a2c7a42bea9a1c3aebd0730f5","beforePath":"docs/plans/04-go-runtime.md","status":"renamed"},{"afterBlob":"bfc4e511c73b3b4cda9a76f40c16d525ece5fa7a","afterPath":"docs/plans/archive/05-spec-freeze.md","beforeBlob":"bfc4e511c73b3b4cda9a76f40c16d525ece5fa7a","beforePath":"docs/plans/05-spec-freeze.md","status":"renamed"},{"afterBlob":"85612e5dfbe0eca7359ba4a18a84b67e5b48dfd9","afterPath":"docs/plans/archive/06-function-bodies-and-trait-dispatch.md","beforeBlob":"85612e5dfbe0eca7359ba4a18a84b67e5b48dfd9","beforePath":"docs/plans/06-function-bodies-and-trait-dispatch.md","status":"renamed"}],"recordKind":"checkpoint-change-unit","schemaVersion":"1.0"}
