{"$id":"https://vexil.dev/release/checkpoint-change-units/runtime-go-0-1-1-source-version.json","$schema":"https://json-schema.org/draft/2020-12/schema","baseCommit":"e337e8fee90171179e8cd8f3f1bd26db45e1fe57","behavior":"Updates only the checked-in Go runtime source version from 0.1.0 to 0.1.1; it does not create a tag, module-proxy version, Manifest, approval, Run, or publication.","changeUnitId":"runtime-go-0-1-1-source-version","checkpointCommit":"5726f52ce0b7ff4c39da793a235ec0edeaae1319","dependencies":[],"disposition":"approved","evidence":["git diff --no-ext-diff --binary --full-index e337e8fee90171179e8cd8f3f1bd26db45e1fe57 5726f52ce0b7ff4c39da793a235ec0edeaae1319 -- packages/runtime-go/VERSION","selected source commit 99e2afef4d48ab35ec61e8b23a9c0d6c210e275f contains checkpoint commit"],"intent":"Prepare the exact source version selected for the first recovered Go module release.","owner":{"assignmentId":"assignment-package-steward-runtime-go-2026-07-14","roleId":"package-steward"},"patchDigest":"sha256:9f735d2335931a830132c20fbaf66290b5f8356cee75121a99753e2f46599aaa","paths":[{"afterBlob":"17e51c385ea382d4f2ef124b7032c1604845622d","afterPath":"packages/runtime-go/VERSION","beforeBlob":"6e8bf73aa550d4c57f6f35830f1bcdc7a4a62f38","beforePath":"packages/runtime-go/VERSION","status":"modified"}],"recordKind":"checkpoint-change-unit","schemaVersion":"1.0"}
