{"$id":"https://vexil.dev/release/checkpoint-change-units/checkpoint-python-generator-fix.json","$schema":"https://json-schema.org/draft/2020-12/schema","baseCommit":"11f315880415038ac6013d7ee4d378296cd51c5d","behavior":"No approval or promotion is asserted; the record preserves the checkpoint slice for independent review against current public main.","changeUnitId":"checkpoint-python-generator-fix","checkpointCommit":"d4099e8188f40603ebf52473d6543ce4a6054201","dependencies":[],"disposition":"proposed","evidence":["cargo test -p vexil-codegen-py","five matching Python golden files"],"intent":"Correct Python generator array access interpolation and retain the five matching golden expectations as one behavioral unit.","owner":{"assignmentId":"assignment-package-steward-vexil-lang-2026-07-14","roleId":"package-steward"},"patchDigest":"sha256:ada84d9959126e978725c2a08346a0c2eac6366bf4280c35b628f4a6dc9ee564","paths":[{"afterBlob":"04c783c909574d8fe3367518711707e82fff5fc6","afterPath":"crates/vexil-codegen-py/src/message.rs","beforeBlob":"82c1e229e63bc34dd1b4aea543f594625a3298c0","beforePath":"crates/vexil-codegen-py/src/message.rs","status":"modified"},{"afterBlob":"c72f0cd64304d673c4600249e9036c6267cd4ed7","afterPath":"crates/vexil-codegen-py/tests/golden/005_parameterized.py","beforeBlob":"e7d259f5ba44f4578934cccfbc68b29c615185c9","beforePath":"crates/vexil-codegen-py/tests/golden/005_parameterized.py","status":"modified"},{"afterBlob":"a2ceefb8e4734704fdff145feb32db780099be4d","afterPath":"crates/vexil-codegen-py/tests/golden/013_annotations.py","beforeBlob":"33096031c37fc6c8d864549a95de2c125fc1d490","beforePath":"crates/vexil-codegen-py/tests/golden/013_annotations.py","status":"modified"},{"afterBlob":"079feb6be488975ea7dddb0bafdd9ccfa95317f9","afterPath":"crates/vexil-codegen-py/tests/golden/016_recursive.py","beforeBlob":"6d14c83b97c80c5d058c7e2d7824b74165d777e4","beforePath":"crates/vexil-codegen-py/tests/golden/016_recursive.py","status":"modified"},{"afterBlob":"b56abeb74cf105724bbc99f78a6c908c85008c65","afterPath":"crates/vexil-codegen-py/tests/golden/022_nested_schemas.py","beforeBlob":"240ecc7605ef448e9c3dd09e02169b0fd75d1607","beforePath":"crates/vexil-codegen-py/tests/golden/022_nested_schemas.py","status":"modified"},{"afterBlob":"d70c4e8801f1737846fa598cd18fcd629351e4fc","afterPath":"crates/vexil-codegen-py/tests/golden/023_recursive_depth.py","beforeBlob":"163af4ffe06bea1799fca232b20473f16c552e67","beforePath":"crates/vexil-codegen-py/tests/golden/023_recursive_depth.py","status":"modified"}],"recordKind":"checkpoint-change-unit","schemaVersion":"1.0"}
